,Legal Name,Ignore,Website,AddressProvided,City,State,Zip,Country/Area,lat,lon,display
271,Biovex Ltd,-,https://www.bionity.com/en/companies/12432/biovex-ltd.html,-,Abingdon,-,-,United Kingdom,51.671484,-1.277972,"Abingdon, Vale of White Horse, Oxfordshire, England, OX14 3UJ, United Kingdom"
272,"Sterigenics US, LLC",-,https://sterigenics.com/,-,Hayward,California,94545,United States,37.668821,-122.080796,"Hayward, Alameda County, California, United States"
273,"Zimmer Spine, Inc.",-,https://www.zimmerbiomet.com/en,-,Memphis,Tennessee,38118,United States,35.133502,-89.966876,"Memphis, Shelby County, West Tennessee, Tennessee, United States"
274,Viracor-IBT Laboratories,-,https://www.eurofins-viracor.com/clinical/news-and-events/posts/2013/november/viracor-ibt-laboratories-acquires-assets-of-the-national-institute-of-transplantation/,-,Los Angeles,California,90057,United States,34.053691,-118.242766,"Los Angeles, Los Angeles County, California, United States"
275,"Zimmer Solutions, Inc",-,https://www.zimmerbiomet.com/en,-,Theodore,Alabama,36582,United States,30.547295,-88.180204,"Theodore, Mobile County, Alabama, 36582, United States"
276,Office of Chief Medical Examiner Decomposition Room,-,https://www1.nyc.gov/site/ocme/index.page,-,Smithtown,New York,11787,United States,40.855931,-73.200669,"Smithtown, Town of Smithtown, Suffolk County, New York, 11787, United States"
277,XTANT Medical,-,https://xtantmedical.com/,-,Belgrade,Montana,59714,United States,45.773279,-111.184535,"Belgrade, Gallatin County, Montana, 59714, United States"
278,AXIS Spine LLC,-,https://www.axisspinecenter.com/,-,Westlake Village,California,91361,United States,34.146023,-118.806179,"Westlake Village, Los Angeles County, California, United States"
279,Eversight,-,https://www.eversightvision.org/,-,Clark,New Jersey,7066,United States,40.623399,-74.314828,"Clark, Union County, New Jersey, United States"
280,Axogen Corporation,-,https://www.axogeninc.com,-,Burleson,Texas,76028,United States,30.476488,-96.635349,"Burleson County, Texas, United States"
281,"Tritium BioSciences, LLC",-,https://www.bizapedia.com/us/tritium-biosciences-llc.html,-,Cordova,Tennessee,38018,United States,35.155645,-89.776196,"Cordova, Memphis, Shelby County, West Tennessee, Tennessee, 38018, United States"
282,"Max Spine, LLC",-,https://www.corporationwiki.com/Texas/El-Paso/max-spine-llc/37765531.aspx,-,El Paso,Texas,79902,United States,31.786562,-106.441207,"El Paso, El Paso County, Texas, United States"
283,Interventional Spine Inc,-,http://interventionalspine.net/,-,Irvine,California,92618,United States,33.685697,-117.825982,"Irvine, Orange County, California, United States"
284,Fisher Bioservices,-,http://www.fisherbioservices.com/,-,Rockville,Maryland,20850,United States,39.081798,-77.151684,"Rockville, Montgomery County, Maryland, United States"
285,Baptist Health Lexington,-,https://www.baptisthealth.com/lexington/,-,Lexington,Kentucky,40503,United States,38.0187,-84.512354,"Baptist Health, 1740, Nicholasville Road, WGPL, Lexington, Fayette County, Kentucky, 40503, United States"
286,"Affirmative Solutions, LLC",-,https://affirmative-solutions.com/,-,Woodstock,Georgia,30188,United States,34.101411,-84.519219,"Woodstock, Cherokee County, Georgia, United States"
287,Dendreon Pharmaceuticals LLC,-,https://www.dendreon.com/,-,Seal Beach,California,90740,United States,33.742397,-118.105593,"Seal Beach, Orange County, California, United States"
288,"West Virginia Biologics, LLC",-,http://www.wvbiological.com/,-,Huntington,West Virginia,25701,United States,38.41925,-82.445154,"Huntington, Cabell County, West Virginia, United States"
289,New York Firefighters Skin Bank New York Presbyterian Hosp,-,https://www.nyp.org/burn-center/burn-center-specialized-programs,-,New York,New York,10065,United States,36.102279,-115.176022,"New York New York, Paradise, Clark County, Nevada, 89158, United States"
290,"Nuvasive PR, Inc.",-,https://www.nuvasive.com/,-,Guaynabo,Puerto Rico,968,United States,18.358149,-66.111697,"Guaynabo, Puerto Rico, United States"
291,Next Step Medical Co Inc,-,"https://npino.com/medical-supplies/1669510327-next-step-medical,-co./",-,Rio Piedras,Puerto Rico,925,United States,18.397423,-66.050111,"Río Piedras, Puerto Rico, 00925, United States"
292,"Sentry Biopharma Services, Inc.",-,https://sentrybps.com/,-,Indianapolis,Indiana,46241,United States,39.768333,-86.15835,"Indianapolis, Marion County, Indiana, United States"
293,Stanford Clinical Laboratory at Hillview,-,https://stanfordlab.com/clinical-pathology.html,-,Palo Alto,California,94304,United States,37.444329,-122.159847,"Palo Alto, Santa Clara County, California, United States"
294,Mayo Clinic Florida,-,https://www.mayoclinic.org/patient-visitor-guide/florida,-,Jacksonville,Florida,32224,United States,30.260466,-81.444794,"Mayo Clinic Jacksonville Campus, 4500, San Pablo Parkway, Jacksonville, Duval County, Florida, 32224, United States"
295,Medtronic,-,https://www.medtronic.com/us-en/index.html,-,Minneapolis,Minnesota,55416,United States,44.974102,-93.259289,"Medtronic Plaza, Minneapolis, Hennepin County, Minnesota, United States"
296,Medtronic Inc,-,https://www.medtronic.com/us-en/index.html,-,Tempe,Arizona,85281,United States,33.425506,-111.940009,"Tempe, Maricopa County, Arizona, United States"
297,Sterigenics U.S. LLC,-,https://sterigenics.com/,-,Mulberry,Florida,33860,United States,27.895304,-81.973417,"Mulberry, Polk County, Florida, United States"
298,"Osteomed, LLC",-,https://www.linkedin.com/company/osteomed/,-,Addison,Texas,75001,United States,32.960478,-96.830067,"Addison, Dallas County, Texas, 75001, United States"
299,"University Of Chicago Medical Ctr, Clinical Microbiology",-,https://microbiology.uchicago.edu/,-,Chicago,Illinois,60637,United States,41.875562,-87.624421,"Chicago, Cook County, Illinois, United States"
300,UW Medicine - University of Washington,-,https://www.uwmedicine.org/,-,Seattle,Washington,98195,United States,47.603832,-122.330062,"Seattle, King County, Washington, United States"
301,University of Washington Med Center - Roosevelt,-,https://www.uwmedicine.org/locations/general-internal-medicine-center-uwmc-roosevelt,-,Seattle,Washington,98105,United States,47.603832,-122.330062,"Seattle, King County, Washington, United States"
302,Vericel Corporation,-,https://www.vcel.com/,-,Cambridge,Massachusetts,2139,United States,42.3751,-71.105616,"Cambridge, Middlesex County, Massachusetts, United States"
303,AMG MED GROUP Corp,-,https://www.amgmedicalgroup.com/,-,Davie,Florida,33324,United States,26.062866,-80.233104,"Davie, Broward County, Florida, United States"
304,NIH Clinical Center,-,https://clinicalcenter.nih.gov/,-,Bethesda,Maryland,20892,United States,39.001645,-77.104542,"NIH Clinical Center, 10, Center Drive, Alta Vista, Maplewood, Bethesda, Montgomery County, Maryland, 20892, United States"
305,Impact Ortho Inc,-,https://www.impact-ortho.com/about-us/our-team/,-,San Diego,California,92121,United States,32.71742,-117.162773,"San Diego, San Diego County, California, United States"
306,Center For Womens's Medicine,-,https://womanshospital.com/,-,Houston,Texas,77079,United States,29.758938,-95.367697,"Houston, Harris County, Texas, United States"
307,"Integra Lifescience, LLC",-,https://www.integralife.com/,-,Fenton,Missouri,63026,United States,38.513199,-90.440058,"Fenton, Saint Louis County, Missouri, 63029, United States"
308,"Sunstar Americas, Inc.",-,https://www.sunstar.com/,-,Schaumburg,Illinois,60195,United States,42.033361,-88.083406,"Schaumburg, Schaumburg Township, Cook County, Illinois, United States"
309,"IntegraMed Medical Connecticut, LLC",-,https://imedcenter.com/,-,Trumbull,Connecticut,6611,United States,41.242874,-73.200669,"Trumbull, Fairfield County, Connecticut, 06611, United States"
310,TelaGen LLC,-,https://www.telagenllc.com/,-,Pensacola,Florida,32504,United States,30.421309,-87.216915,"Pensacola, Escambia County, Florida, United States"
311,"InterMountain Medical, Inc",-,https://intermountainhealthcare.org/,-,Lakewood,Colorado,80215,United States,39.708574,-105.084669,"Lakewood, Jefferson County, Colorado, United States"
312,"Vivorte, Inc.",-,https://vivorte.com/about/,-,Louisville,Kentucky,40204,United States,38.254238,-85.759407,"Louisville, Jefferson County, Kentucky, United States"
313,Stanford Healthcare ValleyCare,-,https://valleycare.com/,-,Pleasanton,California,94588,United States,37.662431,-121.874679,"Pleasanton, Alameda County, California, United States"
314,"Department of Air Force, 59th Medical Wing/SGVLB",-,https://www.59mdw.af.mil/,-,Lackland Afb,Texas,78236,United States,29.386286,-98.6009,"Lackland Air Force Base, Bexar County, Texas, United States"
315,HCA Health Services of Tennessee dba TriStar Centennial,-,https://tristarhealth.com/locations/tristar-centennial/,-,Nashville,Tennessee,37203,United States,36.162277,-86.774298,"Nashville-Davidson, Davidson County, Tennessee, United States"
316,"Regenerative Biologics, Inc.",-,https://regenerative-biologics.com/,-,Melbourne,Florida,32935,United States,28.106471,-80.637151,"Melbourne, Brevard County, Florida, United States"
317,Vivex Biomedical Inc,-,https://vivex.com/,-,Marietta,Georgia,30062,United States,33.952847,-84.549615,"Marietta, Cobb County, Georgia, United States"
318,"Alpha Med Distributors, LLC",-,https://alphamedicalllc.com/,-,Frisco,Texas,75034,United States,33.150674,-96.823612,"Frisco, Collin County, Texas, United States"
319,"Amniox Medical, Inc",-,https://biotissue.com/,-,Atlanta,Georgia,30339,United States,33.748992,-84.390264,"Atlanta, Fulton County, Georgia, United States"
320,"Artivion, Inc",-,https://artivion.com/,-,Kennesaw,Georgia,30144,United States,34.023434,-84.61549,"Kennesaw, Cobb County, Georgia, United States"
321,US Stem Cell Inc,-,http://us-stemcell.com/,-,Sunrise,Florida,33325,United States,26.166689,-80.278757,"Sunrise, Broward County, Florida, United States"
322,"Fibrocell Technologies, Inc.",-,http://www.fibrocell.com/technology/index.html,-,Exton,Pennsylvania,19341,United States,40.029859,-75.628978,"Exton, West Whiteland Township, Chester County, Pennsylvania, 19341, United States"
323,Tutogen Medical GmbH,-,http://www.tutogen.de,-,Neunkirchen a. Brand,-,-,Germany,49.607197,11.133596,"RTI Surgical Tutogen Medical GmbH, 6, Industriestraße, Neunkirchen a.Brand, Landkreis Forchheim, Bayern, 91077, Deutschland"
324,Liventa Bioscience Inc.,-,http://www.liventabioscience.com/,-,Conshohocken,Pennsylvania,19428,United States,40.079277,-75.301571,"Conshohocken, Montgomery County, Pennsylvania, 19428, United States"
325,"Hausten Healthcare, LLC",-,http://www.hausten-h.com/english/,-,Honolulu,Hawaii,96826,United States,21.304547,-157.855676,"Honolulu, Honolulu County, Hawaii, United States"
326,"ArtiMed Solutions, LLC.",-,https://opencorporates.com/companies/us_tx/0801748364,-,Dallas,Texas,75218,United States,32.776272,-96.796856,"Dallas, Dallas County, Texas, United States"
327,"Medalliance, Inc",-,https://medalliance.com/,-,Glenside,Pennsylvania,19038,United States,40.102333,-75.152119,"Glenside, Abington Township, Montgomery County, Pennsylvania, 19038, United States"
328,"Sunrise Medical Laboratories, Inc.",-,https://www.sunriselab.com/,-,Hicksville,New York,11801,United States,40.768193,-73.523821,"Hicksville, Town of Oyster Bay, Nassau County, New York, 11801, United States"
329,VA Tennessee Valley Healthcare System - Nashville Campus,-,https://www.va.gov/tennessee-valley-health-care/,-,Nashville,Tennessee,37212,United States,36.162277,-86.774298,"Nashville-Davidson, Davidson County, Tennessee, United States"
330,"Nelson Labs Fairfield, Inc.",-,https://www.nelsonlabs.com/locations/fairfield-new-jersey-usa/,-,Fairfield,New Jersey,7004,United States,40.88371,-74.305982,"Fairfield, Essex County, New Jersey, 07004, United States"
331,"South Bend Medical Foundation, Inc.",-,https://www.sbmf.org/,-,South Bend,Indiana,46601,United States,41.683381,-86.250007,"South Bend, Saint Joseph County, Indiana, United States"
332,Zimmer Etex,-,https://www.zimmerbiomet.com/en,-,Sanford,Florida,32771,United States,28.811735,-81.268022,"Sanford, Seminole County, Florida, United States"
333,Alliqua Biomedical,-,https://www.biospace.com/article/releases/celularity-scoops-up-alliqua-biomedical-in-29m-deal/,-,Langhorne,Pennsylvania,19047,United States,40.174554,-74.922667,"Langhorne, Bucks County, Pennsylvania, United States"
334,Charles River Laboratories Inc,-,https://www.criver.com/,-,Memphis,Tennessee,38118,United States,35.133502,-89.966876,"Memphis, Shelby County, West Tennessee, Tennessee, United States"
335,Allomed Biologics,-,https://www.allomed.at/en/about-us/,-,Tucson,Arizona,85712,United States,32.222876,-110.974848,"Tucson, Pima County, Arizona, United States"
336,"Argon Medical USA, LLC",-,https://www.argonmedical.com/,-,Marshfield,Wisconsin,54449,United States,44.668852,-90.171799,"Marshfield, Wood County, Wisconsin, 54449, United States"
337,MayoClinic,-,https://www.mayoclinic.org/patient-visitor-guide/florida,-,Maple Grove,Minnesota,55369,United States,45.098498,-93.441922,"Maple Grove, Hennepin County, Minnesota, United States"
338,Meridian LifeSciences LLC,-,https://www.meridianbioscience.com/lifescience/about-life-science/,-,San Antonio,Texas,78232,United States,29.4246,-98.495141,"San Antonio, Bexar County, Texas, United States"
339,Medtronic Inc,-,https://www.medtronic.com/us-en/index.html,-,West Des Moines,Iowa,50266,United States,41.564448,-93.759406,"West Des Moines, Polk County, Iowa, United States"
340,Inova Health Care Services,-,https://www.inova.org/,-,Sterling,Virginia,20166,United States,39.00381,-77.408328,"Sterling, Loudoun County, Virginia, 20164, United States"
